<?xml version='1.0' encoding='utf-8'?>

<!-- Copyright (C) 2011 Swiss Library for the Blind, Visually Impaired and Print Disabled -->

<!-- This file is part of dtbooksbsform. -->

<!-- dtbooksbsform is free software: you can redistribute it -->
<!-- and/or modify it under the terms of the GNU Lesser General Public -->
<!-- License as published by the Free Software Foundation, either -->
<!-- version 3 of the License, or (at your option) any later version. -->

<!-- This program is distributed in the hope that it will be useful, -->
<!-- but WITHOUT ANY WARRANTY; without even the implied warranty of -->
<!-- MERCHANTABILITY or FITNESS FOR A PARTICULAR PURPOSE. See the GNU -->
<!-- Lesser General Public License for more details. -->

<!-- You should have received a copy of the GNU Lesser General Public -->
<!-- License along with this program. If not, see -->
<!-- <http://www.gnu.org/licenses/>. -->

<!DOCTYPE utfx:tests PUBLIC "-//UTF-X//DTD utfx-tests 1.0//EN" "utfx_tests.dtd">
<utfx:tests xmlns:utfx="http://utfx.org/test-definition"
  xmlns:dtb="http://www.daisy.org/z3986/2005/dtbook/"
  xmlns:brl="http://www.daisy.org/z3986/2009/braille/">
  <utfx:stylesheet src="xsl/dtbook2sbsform.xsl"/>

  <!-- ~~~~~~~~~~~~~~~~~~~~~~~~~~~~~~~~~~~~~~~~~~~~~~~~~~~~~~~~~~~~~~~~~~~~~~ -->
  <!-- test for <em> starting or ending with dash -->
  <!-- ~~~~~~~~~~~~~~~~~~~~~~~~~~~~~~~~~~~~~~~~~~~~~~~~~~~~~~~~~~~~~~~~~~~~~~ -->
  <!-- Expected Failure -->
  <!-- There is still a bug here with the - in that it puts a hyphen
       mark after the -. This is apparently related to the liblouis
       tables not to the xsl -->
  <!-- <utfx:test> -->
  <!--   <utfx:name>test for &lt;em&gt; starting with dash</utfx:name> -->
  <!--   <utfx:stylesheet-params> -->
  <!--     <utfx:with-param name="contraction" select="0"/> -->
  <!--   </utfx:stylesheet-params> -->
  <!--   <utfx:assert-equal> -->
  <!--     <utfx:source> -->
  <!--       <stub xml:lang="de">auf<dtb:em>fallen</dtb:em> und <dtb:em>-steigen</dtb:em> </stub> -->
  <!--     </utfx:source> -->
  <!--     <utfx:expected>AUF'_FALLEN UND '-_STEIGEN </utfx:expected> -->
  <!--   </utfx:assert-equal> -->
  <!-- </utfx:test> -->

  <!-- Expected Failure -->
  <!-- There is still a bug here with the - in that it puts a hyphen
       mark after the -. This is apparently related to the liblouis
       tables not to the xsl -->
  <!-- <utfx:test> -->
  <!--   <utfx:name>test for &lt;em&gt; ending with dash</utfx:name> -->
  <!--   <utfx:stylesheet-params> -->
  <!--     <utfx:with-param name="contraction" select="0"/> -->
  <!--   </utfx:stylesheet-params> -->
  <!--   <utfx:assert-equal> -->
  <!--     <utfx:source> -->
  <!--       <stub xml:lang="de"><dtb:em>hin-</dtb:em> und <dtb:em>her</dtb:em>gehen </stub> -->
  <!--     </utfx:source> -->
  <!--     <utfx:expected>_HIN- UND _HER'.GEHEN</utfx:expected> -->
  <!--   </utfx:assert-equal> -->
  <!-- </utfx:test> -->

  <utfx:test>
    <utfx:name>test for text starting with space followed by dash</utfx:name>
    <utfx:stylesheet-params>
      <utfx:with-param name="contraction" select="0"/>
    </utfx:stylesheet-params>
    <utfx:assert-equal>
      <utfx:source>
        <dtb:p xml:lang="de"> -steigen</dtb:p>
      </utfx:source>
      <utfx:expected>y P&#13;  '-STEIGEN</utfx:expected>
    </utfx:assert-equal>
  </utfx:test>

</utfx:tests>
